{
  "aircraftModel": "flying_trainer_one",
  "approvedExclusions": [
    "stall_speed_clean",
    "stall_speed_landing",
    "maximum_level_speed",
    "cruise_speed_65_percent",
    "best_rate_climb",
    "service_ceiling",
    "best_glide",
    "power_off_sink",
    "takeoff_ground_roll",
    "landing_ground_roll",
    "engine_static_rpm_power_fuel_temperature",
    "phugoid_dutch_roll_spiral",
    "control_step_response",
    "coordinated_turn_30_deg",
    "ground_effect_liftoff",
    "crosswind_takeoff_landing",
    "main_tire_slip",
    "maximum_braking"
  ],
  "blockerRegistry": "docs/blockers/external-inputs.yml",
  "faithfulTypeClaim": false,
  "faithfulTypeClaimBlockedBy": "aircraft-poh-afm-validation-rights",
  "mandatoryReferenceBackedFailures": [],
  "referenceRegistry": "docs/validation/aircraft/flying_trainer_one/reference-registry.json",
  "releaseBlockingStatus": "blocked_missing_credible_reference_data",
  "requiredCategories": [
    "braking",
    "climb_rate",
    "control_step_responses",
    "coordinated_turns",
    "crosswind",
    "engine_rpm_power_fuel_temperature_points",
    "glide",
    "ground_effect",
    "landing_distance",
    "maximum_and_cruise_speeds",
    "service_ceiling",
    "sink_rate",
    "stability_modes",
    "stall_speeds",
    "takeoff_distance",
    "tire_slip"
  ],
  "results": [
    {
      "category": "stall_speeds",
      "deviationGraph": "docs/validation/aircraft/flying_trainer_one/graphs/stall_speed_clean.csv",
      "deviationGraphRows": [
        {
          "actual": "",
          "deviation": "",
          "metric": "stallSpeedMps",
          "missingDataReason": "No licensed POH/AFM, flight-test, CFD, wind-tunnel, or equivalent credible reference data is available for this mandatory validation metric.",
          "reference": "",
          "status": "approved_exclusion_missing_credible_data",
          "tolerance": ""
        }
      ],
      "inputs": {
        "bankDeg": 0.0,
        "flapsNorm": 0.0,
        "massKg": 842.4,
        "power": "idle"
      },
      "outputs": {
        "stallSpeedMps": null
      },
      "referenceSource": "missing-poh-afm-flight-test-cfd-windtunnel",
      "referenceSourceDocument": "docs/governance/m0-aircraft-data-gate.md",
      "releaseBlocking": true,
      "resultStatus": "approved_exclusion_missing_credible_data",
      "scenarioId": "stall_speed_clean",
      "sourceReleaseBlocking": false,
      "stateHash": "0x0000000000000000",
      "title": "Clean stall speed",
      "tolerance": {
        "status": "not_defined_missing_credible_data"
      }
    },
    {
      "category": "stall_speeds",
      "deviationGraph": "docs/validation/aircraft/flying_trainer_one/graphs/stall_speed_landing.csv",
      "deviationGraphRows": [
        {
          "actual": "",
          "deviation": "",
          "metric": "stallSpeedMps",
          "missingDataReason": "No licensed POH/AFM, flight-test, CFD, wind-tunnel, or equivalent credible reference data is available for this mandatory validation metric.",
          "reference": "",
          "status": "approved_exclusion_missing_credible_data",
          "tolerance": ""
        }
      ],
      "inputs": {
        "bankDeg": 0.0,
        "flapsNorm": 1.0,
        "massKg": 842.4,
        "power": "idle"
      },
      "outputs": {
        "stallSpeedMps": null
      },
      "referenceSource": "missing-poh-afm-flight-test-cfd-windtunnel",
      "referenceSourceDocument": "docs/governance/m0-aircraft-data-gate.md",
      "releaseBlocking": true,
      "resultStatus": "approved_exclusion_missing_credible_data",
      "scenarioId": "stall_speed_landing",
      "sourceReleaseBlocking": false,
      "stateHash": "0x0000000000000000",
      "title": "Landing-configuration stall speed",
      "tolerance": {
        "status": "not_defined_missing_credible_data"
      }
    },
    {
      "category": "maximum_and_cruise_speeds",
      "deviationGraph": "docs/validation/aircraft/flying_trainer_one/graphs/maximum_level_speed.csv",
      "deviationGraphRows": [
        {
          "actual": "",
          "deviation": "",
          "metric": "trueAirspeedMps",
          "missingDataReason": "No licensed POH/AFM, flight-test, CFD, wind-tunnel, or equivalent credible reference data is available for this mandatory validation metric.",
          "reference": "",
          "status": "approved_exclusion_missing_credible_data",
          "tolerance": ""
        }
      ],
      "inputs": {
        "isaDeviationC": 0.0,
        "power": "rated",
        "pressureAltitudeM": 0.0
      },
      "outputs": {
        "trueAirspeedMps": null
      },
      "referenceSource": "missing-poh-afm-flight-test-cfd-windtunnel",
      "referenceSourceDocument": "docs/governance/m0-aircraft-data-gate.md",
      "releaseBlocking": true,
      "resultStatus": "approved_exclusion_missing_credible_data",
      "scenarioId": "maximum_level_speed",
      "sourceReleaseBlocking": false,
      "stateHash": "0x0000000000000000",
      "title": "Maximum level speed at rated power",
      "tolerance": {
        "status": "not_defined_missing_credible_data"
      }
    },
    {
      "category": "maximum_and_cruise_speeds",
      "deviationGraph": "docs/validation/aircraft/flying_trainer_one/graphs/cruise_speed_65_percent.csv",
      "deviationGraphRows": [
        {
          "actual": "",
          "deviation": "",
          "metric": "trueAirspeedMps",
          "missingDataReason": "No licensed POH/AFM, flight-test, CFD, wind-tunnel, or equivalent credible reference data is available for this mandatory validation metric.",
          "reference": "",
          "status": "approved_exclusion_missing_credible_data",
          "tolerance": ""
        },
        {
          "actual": "",
          "deviation": "",
          "metric": "fuelFlowKgPerHour",
          "missingDataReason": "No licensed POH/AFM, flight-test, CFD, wind-tunnel, or equivalent credible reference data is available for this mandatory validation metric.",
          "reference": "",
          "status": "approved_exclusion_missing_credible_data",
          "tolerance": ""
        }
      ],
      "inputs": {
        "isaDeviationC": 0.0,
        "powerPercent": 65.0,
        "pressureAltitudeM": 1828.8
      },
      "outputs": {
        "fuelFlowKgPerHour": null,
        "trueAirspeedMps": null
      },
      "referenceSource": "missing-poh-afm-flight-test-cfd-windtunnel",
      "referenceSourceDocument": "docs/governance/m0-aircraft-data-gate.md",
      "releaseBlocking": true,
      "resultStatus": "approved_exclusion_missing_credible_data",
      "scenarioId": "cruise_speed_65_percent",
      "sourceReleaseBlocking": false,
      "stateHash": "0x0000000000000000",
      "title": "65 percent cruise speed",
      "tolerance": {
        "status": "not_defined_missing_credible_data"
      }
    },
    {
      "category": "climb_rate",
      "deviationGraph": "docs/validation/aircraft/flying_trainer_one/graphs/best_rate_climb.csv",
      "deviationGraphRows": [
        {
          "actual": "",
          "deviation": "",
          "metric": "verticalSpeedMps",
          "missingDataReason": "No licensed POH/AFM, flight-test, CFD, wind-tunnel, or equivalent credible reference data is available for this mandatory validation metric.",
          "reference": "",
          "status": "approved_exclusion_missing_credible_data",
          "tolerance": ""
        },
        {
          "actual": "",
          "deviation": "",
          "metric": "climbSpeedMps",
          "missingDataReason": "No licensed POH/AFM, flight-test, CFD, wind-tunnel, or equivalent credible reference data is available for this mandatory validation metric.",
          "reference": "",
          "status": "approved_exclusion_missing_credible_data",
          "tolerance": ""
        }
      ],
      "inputs": {
        "isaDeviationC": 0.0,
        "massKg": 842.4,
        "pressureAltitudeM": 0.0
      },
      "outputs": {
        "climbSpeedMps": null,
        "verticalSpeedMps": null
      },
      "referenceSource": "missing-poh-afm-flight-test-cfd-windtunnel",
      "referenceSourceDocument": "docs/governance/m0-aircraft-data-gate.md",
      "releaseBlocking": true,
      "resultStatus": "approved_exclusion_missing_credible_data",
      "scenarioId": "best_rate_climb",
      "sourceReleaseBlocking": false,
      "stateHash": "0x0000000000000000",
      "title": "Best-rate climb",
      "tolerance": {
        "status": "not_defined_missing_credible_data"
      }
    },
    {
      "category": "service_ceiling",
      "deviationGraph": "docs/validation/aircraft/flying_trainer_one/graphs/service_ceiling.csv",
      "deviationGraphRows": [
        {
          "actual": "",
          "deviation": "",
          "metric": "pressureAltitudeM",
          "missingDataReason": "No licensed POH/AFM, flight-test, CFD, wind-tunnel, or equivalent credible reference data is available for this mandatory validation metric.",
          "reference": "",
          "status": "approved_exclusion_missing_credible_data",
          "tolerance": ""
        }
      ],
      "inputs": {
        "isaDeviationC": 0.0,
        "massKg": 842.4,
        "residualClimbRateMps": 0.508
      },
      "outputs": {
        "pressureAltitudeM": null
      },
      "referenceSource": "missing-poh-afm-flight-test-cfd-windtunnel",
      "referenceSourceDocument": "docs/governance/m0-aircraft-data-gate.md",
      "releaseBlocking": true,
      "resultStatus": "approved_exclusion_missing_credible_data",
      "scenarioId": "service_ceiling",
      "sourceReleaseBlocking": false,
      "stateHash": "0x0000000000000000",
      "title": "Service ceiling at residual climb rate",
      "tolerance": {
        "status": "not_defined_missing_credible_data"
      }
    },
    {
      "category": "glide",
      "deviationGraph": "docs/validation/aircraft/flying_trainer_one/graphs/best_glide.csv",
      "deviationGraphRows": [
        {